{
  "schemaVersion": 1,
  "catalogVersion": 4,
  "editorialStatus": "Proposta de normalização para o Companion; complementações de campos abaixo não alteram o texto-fonte publicado.",
  "sourceRepository": "KindermanBarros/solidao-dos-oprimidos",
  "entries": [
    {
      "id": "power.canal_economico",
      "kind": "POWER",
      "name": "Canal Econômico",
      "group": "Conjuração",
      "summary": "Uma vez por cena, reduza em 1 PM o custo de Magia da Escola, mínimo 1.",
      "cost": "Sem custo adicional",
      "action": "Sem ação adicional à ação desencadeadora",
      "range": "Pessoal",
      "duration": "1 aplicação",
      "source": "50 Exemplos de Poderes Mágicos",
      "version": 4,
      "creationCost": "",
      "price": 0,
      "load": 0,
      "durability": "",
      "region": "",
      "relatedAttribute": "",
      "initialValue": null,
      "prerequisites": [
        "Conhecimento, Escola 2"
      ],
      "mechanicalEffect": "Uma vez por cena, reduza em 1 PM o custo de Magia da Escola, mínimo 1.",
      "ruleReference": "03 - Regras/Magia/50 Exemplos de Poderes Mágicos.md",
      "keywords": [
        "Canal Econômico",
        "Conjuração"
      ],
      "repeatable": false,
      "limit": "Uma vez por cena",
      "activationCondition": "Use sem ação adicional à ação desencadeadora.",
      "enhancements": "Duas vezes por cena.",
      "deactivationCondition": "Após resolver a aplicação ou o teste.",
      "abilitySource": "KNOWLEDGE",
      "sourceKnowledge": "Conjuração",
      "sourceLevel": 0,
      "abilityCostType": "NONE",
      "abilityCostValue": 0,
      "abilityExecution": "ACTION",
      "executionValue": 0,
      "executionUnit": "MINUTES",
      "abilityRange": "PERSONAL",
      "targetArea": "Usuário",
      "abilityDuration": "INSTANT",
      "durationValue": 1,
      "durationUnit": "HOURS",
      "abilityResistance": "NONE"
    },
    {
      "id": "power.conjuracao_cautelosa",
      "kind": "POWER",
      "name": "Conjuração Cautelosa",
      "group": "Conjuração",
      "summary": "Gaste uma Ação Completa para receber +4 na conjuração.",
      "cost": "Sem custo adicional",
      "action": "Ação Completa",
      "range": "Pessoal",
      "duration": "1 aplicação",
      "source": "50 Exemplos de Poderes Mágicos",
      "version": 4,
      "creationCost": "",
      "price": 0,
      "load": 0,
      "durability": "",
      "region": "",
      "relatedAttribute": "",
      "initialValue": null,
      "prerequisites": [
        "Caminho, qualquer Escola 1"
      ],
      "mechanicalEffect": "Gaste uma Ação Completa para receber +4 na conjuração.",
      "ruleReference": "03 - Regras/Magia/50 Exemplos de Poderes Mágicos.md",
      "keywords": [
        "Conjuração Cautelosa",
        "Conjuração"
      ],
      "repeatable": false,
      "limit": "Sem limite adicional",
      "activationCondition": "Use ação completa.",
      "enhancements": "Também ignora a primeira instabilidade menor.",
      "deactivationCondition": "Após resolver a aplicação ou o teste.",
      "abilitySource": "KNOWLEDGE",
      "sourceKnowledge": "Conjuração",
      "sourceLevel": 0,
      "abilityCostType": "NONE",
      "abilityCostValue": 0,
      "abilityExecution": "ACTION",
      "executionValue": 0,
      "executionUnit": "MINUTES",
      "abilityRange": "PERSONAL",
      "targetArea": "Usuário",
      "abilityDuration": "INSTANT",
      "durationValue": 1,
      "durationUnit": "HOURS",
      "abilityResistance": "NONE"
    },
    {
      "id": "power.reserva_oculta",
      "kind": "POWER",
      "name": "Reserva Oculta",
      "group": "Recurso",
      "summary": "Aumenta PM máximo em 2 enquanto a fonte estiver ativa.",
      "cost": "Sem custo adicional",
      "action": "Passiva",
      "range": "Pessoal",
      "duration": "Enquanto a fonte estiver ativa",
      "source": "50 Exemplos de Poderes Mágicos",
      "version": 4,
      "creationCost": "",
      "price": 0,
      "load": 0,
      "durability": "",
      "region": "",
      "relatedAttribute": "",
      "initialValue": null,
      "prerequisites": [
        "Item ou narrativa"
      ],
      "mechanicalEffect": "Aumenta PM máximo em 2 enquanto a fonte estiver ativa.",
      "ruleReference": "03 - Regras/Magia/50 Exemplos de Poderes Mágicos.md",
      "keywords": [
        "Reserva Oculta",
        "Recurso"
      ],
      "repeatable": false,
      "limit": "Sem limite adicional",
      "activationCondition": "Passivo; permanece disponível enquanto a fonte do poder estiver ativa.",
      "enhancements": "Aumenta em 4.",
      "deactivationCondition": "Ao perder acesso à fonte.",
      "abilitySource": "KNOWLEDGE",
      "sourceKnowledge": "Recurso",
      "sourceLevel": 0,
      "abilityCostType": "NONE",
      "abilityCostValue": 0,
      "abilityExecution": "PASSIVE",
      "executionValue": 0,
      "executionUnit": "MINUTES",
      "abilityRange": "PERSONAL",
      "targetArea": "Usuário",
      "abilityDuration": "TIME",
      "durationValue": 0,
      "durationUnit": "HOURS",
      "abilityResistance": "NONE"
    },
    {
      "id": "power.mente_ancorada",
      "kind": "POWER",
      "name": "Mente Ancorada",
      "group": "Concentração",
      "summary": "+2 em testes para manter concentração.",
      "cost": "Sem custo adicional",
      "action": "Passiva",
      "range": "Pessoal",
      "duration": "1 teste",
      "source": "50 Exemplos de Poderes Mágicos",
      "version": 4,
      "creationCost": "",
      "price": 0,
      "load": 0,
      "durability": "",
      "region": "",
      "relatedAttribute": "",
      "initialValue": null,
      "prerequisites": [
        "Histórico"
      ],
      "mechanicalEffect": "+2 em testes para manter concentração.",
      "ruleReference": "03 - Regras/Magia/50 Exemplos de Poderes Mágicos.md",
      "keywords": [
        "Mente Ancorada",
        "Concentração"
      ],
      "repeatable": false,
      "limit": "Sem limite adicional",
      "activationCondition": "Passivo; permanece disponível enquanto a fonte do poder estiver ativa.",
      "enhancements": "Uma vez/cena, rerrole falha.",
      "deactivationCondition": "Após resolver a aplicação ou o teste.",
      "abilitySource": "KNOWLEDGE",
      "sourceKnowledge": "Concentração",
      "sourceLevel": 0,
      "abilityCostType": "NONE",
      "abilityCostValue": 0,
      "abilityExecution": "PASSIVE",
      "executionValue": 0,
      "executionUnit": "MINUTES",
      "abilityRange": "PERSONAL",
      "targetArea": "Usuário",
      "abilityDuration": "INSTANT",
      "durationValue": 1,
      "durationUnit": "HOURS",
      "abilityResistance": "NONE"
    },
    {
      "id": "power.canal_doloroso",
      "kind": "POWER",
      "name": "Canal Doloroso",
      "group": "Recurso",
      "summary": "Ao faltar PM, pague 2 PV por 1 PM, máximo POD por cena.",
      "cost": "Variável: 2 PV por 1 PM substituído; máximo POD por cena",
      "action": "Sem ação adicional à ação desencadeadora",
      "range": "Pessoal",
      "duration": "1 aplicação",
      "source": "50 Exemplos de Poderes Mágicos",
      "version": 4,
      "creationCost": "",
      "price": 0,
      "load": 0,
      "durability": "",
      "region": "",
      "relatedAttribute": "",
      "initialValue": null,
      "prerequisites": [
        "Narrativa"
      ],
      "mechanicalEffect": "Ao faltar PM, pague 2 PV por 1 PM, máximo POD por cena.",
      "ruleReference": "03 - Regras/Magia/50 Exemplos de Poderes Mágicos.md",
      "keywords": [
        "Canal Doloroso",
        "Recurso"
      ],
      "repeatable": false,
      "limit": "Sem limite adicional",
      "activationCondition": "Use sem ação adicional à ação desencadeadora e pague Variável: 2 PV por 1 PM substituído; máximo POD por cena.",
      "enhancements": "Taxa passa a 1 PV por 1 PM.",
      "deactivationCondition": "Após resolver a aplicação ou o teste.",
      "abilitySource": "KNOWLEDGE",
      "sourceKnowledge": "Recurso",
      "sourceLevel": 0,
      "abilityCostType": "ARCANE",
      "abilityCostValue": 2,
      "abilityExecution": "ACTION",
      "executionValue": 0,
      "executionUnit": "MINUTES",
      "abilityRange": "PERSONAL",
      "targetArea": "Usuário",
      "abilityDuration": "INSTANT",
      "durationValue": 1,
      "durationUnit": "HOURS",
      "abilityResistance": "NONE"
    },
    {
      "id": "power.escola_favorita",
      "kind": "POWER",
      "name": "Escola Favorita",
      "group": "Conhecimento",
      "summary": "Escolha uma Escola; +1 nos ataques dela.",
      "cost": "Sem custo adicional",
      "action": "Passiva",
      "range": "Pessoal",
      "duration": "Enquanto a fonte estiver ativa",
      "source": "50 Exemplos de Poderes Mágicos",
      "version": 4,
      "creationCost": "",
      "price": 0,
      "load": 0,
      "durability": "",
      "region": "",
      "relatedAttribute": "",
      "initialValue": null,
      "prerequisites": [
        "Conhecimento, Escola 1"
      ],
      "mechanicalEffect": "Escolha uma Escola; +1 nos ataques dela.",
      "ruleReference": "03 - Regras/Magia/50 Exemplos de Poderes Mágicos.md",
      "keywords": [
        "Escola Favorita",
        "Conhecimento"
      ],
      "repeatable": false,
      "limit": "Sem limite adicional",
      "activationCondition": "Passivo; permanece disponível enquanto a fonte do poder estiver ativa.",
      "enhancements": "Bônus +2.",
      "deactivationCondition": "Ao perder acesso à fonte.",
      "abilitySource": "KNOWLEDGE",
      "sourceKnowledge": "Conhecimento",
      "sourceLevel": 0,
      "abilityCostType": "NONE",
      "abilityCostValue": 0,
      "abilityExecution": "PASSIVE",
      "executionValue": 0,
      "executionUnit": "MINUTES",
      "abilityRange": "PERSONAL",
      "targetArea": "Usuário",
      "abilityDuration": "TIME",
      "durationValue": 0,
      "durationUnit": "HOURS",
      "abilityResistance": "NONE"
    },
    {